{"actor":{"id":"CONSOLE","kind":"CONSOLE"},"budget":{"budgetVersion":"release-2-placement-reservation-budget-v1","estimatedCanonicalBytes":8192,"maximumCanonicalBytes":262144,"maximumDiskBytes":1000000000,"maximumRegions":64,"maximumStoreEntries":4096},"canonicalChecksum":"d3913b025948cba1839eda243d460797b6bc6371153251eb91e3178995bd596f","createdAt":"2026-07-18T00:00:00Z","diskLease":{"fileStoreKey":"test|fs","placementId":"11111111-1111-1111-1111-111111111111","reservedBytes":504627},"envelopeBinding":{"bindingContractVersion":"release-2-placement-reservation-envelope-binding-v1","bindingVersion":1,"sourceEnvelopePlanChecksum":"2ae175a2a3aa6b4062130ac305617d67b96e6fc92b490913a3047a8698a87c1a","sourceMutationEnvelopeChecksum":"d442e1b8f410d825a270c69bf8a79427dadb92a631890214679c1a4416fa2366"},"expiresAt":"2026-07-18T00:10:00Z","leaseState":"PLANNED","operation":"APPLY","operationId":"22222222-2222-2222-2222-222222222222","placementId":"11111111-1111-1111-1111-111111111111","placementPlanBinding":{"bindingContractVersion":"release-2-placement-reservation-plan-binding-v1","bindingVersion":1,"sourcePlacementPlanChecksum":"317dbc1913e56a7985327e50f7c44dcc37333644b6a49a5d96cc9160167a2ddf"},"planVersion":1,"regions":[{"region":{"maxX":63,"maxY":70,"maxZ":63,"minX":0,"minY":64,"minZ":0},"tileId":"tile-x0-z0","tileIndex":0}],"reservationContractVersion":"release-2-placement-reservation-contract-v1","worldId":"33333333-3333-3333-3333-333333333333"}